{
  "$schema": "http://json-schema.org/draft-07/schema#",
  "$id": "https://github.com/mikeparcewski/wicked-garden/blob/main/schemas/wicked-pack.schema.json",
  "title": "wicked-pack.json — third-party pack manifest (skills, editors, blocks)",
  "description": "Drop-in registration manifest for a third-party pack (extension contract, SKILL-RATIONALIZATION §5). Spec 2 adds editors[] and blocks[] (DES-artifact-editor-plugins §5.2); spec-1 packs stay valid. Placed at the pack root next to its skills/ tree. Garden discovers it at runtime from WICKED_PACK_PATH, the registered-pack file, Claude Code plugin dirs, and <project>/.wicked/packs/ — no garden PR required. Executable validation: `npx wicked-garden pack check <dir>` (scripts/pack/check.py).",
  "type": "object",
  "required": ["spec", "name", "vendor", "version"],
  "additionalProperties": false,
  "properties": {
    "$schema": {
      "type": "string",
      "description": "Optional pointer to this schema, for editors."
    },
    "spec": {
      "enum": [1, 2],
      "description": "Manifest spec version. 1: skills only. 2: adds editors[] and blocks[]; domains becomes optional when editors is present."
    },
    "name": {
      "type": "string",
      "pattern": "^[a-z0-9]+(-[a-z0-9]+)*$",
      "maxLength": 64,
      "description": "Pack name, kebab-case, must start with the vendor prefix (e.g. acme-seo). The wicked* prefix is reserved for the first-party catalog."
    },
    "vendor": {
      "type": "string",
      "pattern": "^(?!wicked($|-))[a-z0-9]+(-[a-z0-9]+)*$",
      "maxLength": 64,
      "description": "Vendor prefix all skill names in the pack must carry ({vendor}-{domain}[-{role}]). Exactly 'wicked' and 'wicked-*' are reserved (matching the runtime validator); other vendors that merely start with the letters 'wicked' are allowed."
    },
    "version": {
      "type": "string",
      "pattern": "^\\d+\\.\\d+\\.\\d+",
      "description": "Pack semver."
    },
    "description": {
      "type": "string",
      "description": "One-paragraph pack summary (shown by `pack list`)."
    },
    "skills_dir": {
      "type": "string",
      "default": "skills",
      "description": "Relative path to the skills tree (skills/<skill-name>/SKILL.md). Must stay inside the pack."
    },
    "domains": {
      "type": "array",
      "minItems": 1,
      "description": "The domains this pack contributes. Each declared domain must have exactly one router skill named {vendor}-{domain}; its workers are {vendor}-{domain}-{role} fork skills. Required, except in a spec-2 pack that declares editors.",
      "items": {
        "type": "object",
        "required": ["name"],
        "additionalProperties": false,
        "properties": {
          "name": {
            "type": "string",
            "pattern": "^[a-z0-9]+(-[a-z0-9]+)*$",
            "description": "Bare domain name (e.g. seo). The crew-facing specialist domain becomes {vendor}-{name}."
          },
          "description": { "type": "string" },
          "specialist": {
            "type": "object",
            "description": "Present iff this domain should be crew-routable (the pack equivalent of a specialist.json entry). Registered as {vendor}-{domain}; first-party names always win a collision.",
            "required": ["role"],
            "additionalProperties": false,
            "properties": {
              "role": {
                "type": "string",
                "pattern": "^[a-z0-9]+(-[a-z0-9]+)*$",
                "description": "Human-facing discipline label (e.g. seo-engineering)."
              },
              "description": { "type": "string" },
              "enhances": {
                "type": "array",
                "items": { "type": "string" },
                "description": "Crew phases this specialist enhances: clarify | design | qe | build | review | operate | *"
              }
            }
          },
          "produces": {
            "type": "array",
            "description": "Produces-contract declarations (extension-contract gap 5). Each names an archetype and the produces ids the domain's work yields; gates re-derive them via wicked-vault (`loom gate` consumes the produces id directly). Steering attach is documented in docs/extending.md — declared data today, auto-steering is the named seam.",
            "items": {
              "type": "object",
              "required": ["archetype", "produces"],
              "additionalProperties": false,
              "properties": {
                "archetype": {
                  "type": "string",
                  "description": "One of garden's work-shape archetypes (.claude-plugin/archetypes.json): triage, explore, specify, decide, ship, review, incident, build, migrate, modernize."
                },
                "produces": {
                  "type": "array",
                  "minItems": 1,
                  "items": { "type": "string", "pattern": "^[a-z0-9]+(-[a-z0-9]+)*$" },
                  "description": "Kebab-case produces ids (the vault cross-check --phase values)."
                },
                "gate": {
                  "type": "string",
                  "enum": ["vault"],
                  "default": "vault",
                  "description": "Gate backend. Only the vault re-derivation gate exists; a pack never ships its own gate logic."
                }
              }
            }
          }
        }
      }
    },
    "peers": {
      "type": "object",
      "description": "Peer version floors (extension-contract gap 6), e.g. {\"wicked-garden\": \">=12.29.0\", \"wicked-vault\": \">=0.5.0\"}. Checked FAIL-OPEN: violations are surfaced at SessionStart and by `pack floors`, never blocked on.",
      "additionalProperties": { "type": "string", "pattern": "^(>=|\\^)\\s*\\d+\\.\\d+\\.\\d+$" }
    },
    "provenance": {
      "type": "object",
      "description": "Declared provenance (extension-contract gap 4 — minimal + honest). Registration additionally records a sha256 of this manifest and a content hash of the skills tree. There is NO signing: hashes detect post-registration drift, they do not prove authorship. Install packs only from sources you trust — skills carry shell.",
      "additionalProperties": false,
      "properties": {
        "source": {
          "type": "string",
          "description": "Canonical origin URL (git repo or npm page)."
        },
        "publisher": { "type": "string", "description": "Vendor / maintainer identity as published." },
        "license": { "type": "string" }
      }
    },
    "editors": {
      "type": "array",
      "minItems": 1,
      "description": "Spec 2. Artifact editors this pack ships (DES-artifact-editor-plugins §5.2). Each is ONE self-contained HTML entry inside the pack, pinned by sha256. `pack check` also verifies the file: inside the pack, the hash, the size, and no script/stylesheet/frame loaded from outside it.",
      "items": {
        "type": "object",
        "additionalProperties": false,
        "required": ["id", "title", "version", "protocol", "kinds", "entry", "sha256", "sizes", "permissions"],
        "properties": {
          "id": {
            "type": "string",
            "pattern": "^(?!wicked($|-))[a-z0-9]+(-[a-z0-9]+)*$",
            "maxLength": 64,
            "description": "Unique per install. 'wicked' and 'wicked-*' are refused in every pack: first-party editors ship inside studio."
          },
          "title": {
            "type": "string",
            "minLength": 1,
            "pattern": "\\S",
            "description": "Plain words, shown in Settings → Editors."
          },
          "version": {
            "type": "string",
            "pattern": "^\\d+\\.\\d+\\.\\d+(?:-[0-9A-Za-z.-]+)?(?:\\+[0-9A-Za-z.-]+)?$",
            "description": "The editor's own SemVer, anchored."
          },
          "protocol": {
            "type": "array",
            "minItems": 1,
            "items": { "type": "integer", "minimum": 1 },
            "description": "wicked.editor protocol versions it speaks."
          },
          "kinds": {
            "type": "array",
            "minItems": 1,
            "items": { "type": "string", "pattern": "^[a-z][a-z0-9-]{1,40}$" },
            "description": "Artifact kinds it can open."
          },
          "entry": {
            "type": "string",
            "pattern": "\\.html$",
            "description": "Relative path of the single HTML file (scripts inline)."
          },
          "sha256": {
            "type": "string",
            "pattern": "^[0-9a-f]{64}$",
            "description": "sha256 of the entry file; pinned at install."
          },
          "sizes": {
            "type": "array",
            "items": {
              "enum": ["inline", "pane", "full"]
            },
            "contains": { "const": "inline" },
            "description": "'inline' is required; a missing 'pane' morphs inline to full."
          },
          "panels": {
            "type": "array",
            "items": {
              "enum": ["checks"]
            },
            "description": "Optional host-fed panels it renders."
          },
          "permissions": {
            "type": "array",
            "items": {
              "type": "object",
              "additionalProperties": false,
              "required": ["id", "why"],
              "properties": {
                "id": {
                  "enum": ["artifact.read", "artifact.write", "selection.chip", "composer.draft", "checks.read", "checks.contribute", "sources.read", "media.read", "artifact.export", "ui.fullscreen", "network.media", "mcp.session"]
                },
                "why": {
                  "type": "string",
                  "pattern": "\\S",
                  "description": "The reason shown at install."
                }
              }
            },
            "description": "What it asks for (§6.1), each with its reason."
          },
          "limits": {
            "type": "object",
            "additionalProperties": false,
            "properties": {
              "bundleBytes": {
                "type": "integer",
                "minimum": 1,
                "maximum": 5242880,
                "description": "May only be lower than the host's cap (5 MiB)."
              }
            }
          }
        }
      }
    },
    "blocks": {
      "type": "array",
      "description": "Spec 2. Blocks that PRODUCE this pack's kind (DES-artifact-editor-plugins §9.2): each names a crew preset file inside the pack and the pack skills it uses, approved together at install.",
      "items": {
        "type": "object",
        "additionalProperties": false,
        "required": ["id", "label", "preset", "produces_kind"],
        "properties": {
          "id": {
            "type": "string",
            "pattern": "^(?!wicked($|-))[a-z0-9]+(-[a-z0-9]+)*$",
            "maxLength": 64,
            "description": "'wicked' and 'wicked-*' are refused: first-party blocks are core presets."
          },
          "label": {
            "type": "string",
            "minLength": 1,
            "pattern": "\\S",
            "description": "Plain words the block is offered with."
          },
          "preset": {
            "type": "string",
            "description": "Relative path of the preset JSON inside the pack."
          },
          "produces_kind": { "type": "string", "pattern": "^[a-z][a-z0-9-]{1,40}$" },
          "skills": {
            "type": "array",
            "items": { "type": "string", "pattern": "^[a-z0-9]+(-[a-z0-9]+)*$" },
            "description": "Skills of this pack the block uses."
          }
        }
      }
    }
  },
  "allOf": [
    {
      "if": {
        "properties": {
          "spec": { "const": 1 }
        }
      },
      "then": {
        "required": ["domains"],
        "not": {
          "anyOf": [
            {
              "required": ["editors"]
            },
            {
              "required": ["blocks"]
            }
          ]
        }
      }
    },
    {
      "if": {
        "properties": {
          "spec": { "const": 2 }
        }
      },
      "then": {
        "anyOf": [
          {
            "required": ["domains"]
          },
          {
            "required": ["editors"]
          }
        ]
      }
    }
  ]
}
